{
  "analysis_package_sha256": "1475dde29d9198c4b3fcd561e718989ff729c3a7fa5f809b1faef01166a98137",
  "block_statuses": [
    {
      "block_id": "T",
      "coverage_rate": 1.0,
      "rule_trace": "synthetic_contract_fixture",
      "status": "ND"
    },
    {
      "block_id": "B",
      "coverage_rate": 1.0,
      "rule_trace": "synthetic_contract_fixture",
      "status": "ND"
    },
    {
      "block_id": "C",
      "coverage_rate": 1.0,
      "rule_trace": "synthetic_contract_fixture",
      "status": "ND"
    },
    {
      "block_id": "S",
      "coverage_rate": 1.0,
      "rule_trace": "synthetic_contract_fixture",
      "status": "ND"
    },
    {
      "block_id": "O",
      "coverage_rate": 1.0,
      "rule_trace": "synthetic_contract_fixture",
      "status": "ND"
    },
    {
      "block_id": "M",
      "coverage_rate": 1.0,
      "rule_trace": "synthetic_contract_fixture",
      "status": "ND"
    }
  ],
  "full_report": [
    {
      "block_id": "B",
      "confidence": "ND",
      "evidence_ids": [],
      "factor_id": "B01",
      "formulation": "Целостность scope SISTRIX",
      "priority": null,
      "rating_explanation": "Synthetic contract fixture: factor is marked not applicable.",
      "recommendation": null,
      "status": "NA",
      "why_important": "Целостность scope SISTRIX evaluates Домен/бренд, выбранные модели, страны и фильтры, к которым относятся результаты. The mechanism is supported as platform_definition; the traffic-light cutoffs are classified as deterministic_derivation and are an audit decision unless explicitly official. The result is bounded to the declared universe and does not assert universal ranking causality."
    },
    {
      "block_id": "B",
      "confidence": "ND",
      "evidence_ids": [],
      "factor_id": "B02",
      "formulation": "Observed Brand Prompt Count",
      "priority": null,
      "rating_explanation": "Synthetic contract fixture: factor is marked not applicable.",
      "recommendation": null,
      "status": "NA",
      "why_important": "Observed Brand Prompt Count evaluates Число обнаруженных промптов, в ответах на которые бренд упомянут. The mechanism is supported as platform_definition; the traffic-light cutoffs are classified as internal_audit_policy and are an audit decision unless explicitly official. The result is bounded to the declared universe and does not assert universal ranking causality."
    },
    {
      "block_id": "B",
      "confidence": "ND",
      "evidence_ids": [],
      "factor_id": "B03",
      "formulation": "Observed Domain Citation Prompt Count",
      "priority": null,
      "rating_explanation": "Synthetic contract fixture: factor is marked not applicable.",
      "recommendation": null,
      "status": "NA",
      "why_important": "Observed Domain Citation Prompt Count evaluates Число обнаруженных промптов, в ответах на которые процитирован анализируемый домен. The mechanism is supported as platform_definition; the traffic-light cutoffs are classified as internal_audit_policy and are an audit decision unless explicitly official. The result is bounded to the declared universe and does not assert universal ranking causality."
    },
    {
      "block_id": "B",
      "confidence": "ND",
      "evidence_ids": [],
      "factor_id": "B04",
      "formulation": "Observed Combined Visibility Prompt Count",
      "priority": null,
      "rating_explanation": "Synthetic contract fixture: factor is marked not applicable.",
      "recommendation": null,
      "status": "NA",
      "why_important": "Observed Combined Visibility Prompt Count evaluates Число обнаруженных промптов с упоминанием бренда и/или цитированием домена согласно полю scope. The mechanism is supported as platform_definition; the traffic-light cutoffs are classified as internal_audit_policy and are an audit decision unless explicitly official. The result is bounded to the declared universe and does not assert universal ranking causality."
    },
    {
      "block_id": "B",
      "confidence": "ND",
      "evidence_ids": [],
      "factor_id": "B06",
      "formulation": "Покрытие AI-моделей",
      "priority": null,
      "rating_explanation": "Synthetic contract fixture: factor is marked not applicable.",
      "recommendation": null,
      "status": "NA",
      "why_important": "Покрытие AI-моделей evaluates Какие модели доступны в SISTRIX и по каким моделям реально возвращены результаты. The mechanism is supported as platform_definition; the traffic-light cutoffs are classified as internal_audit_policy and are an audit decision unless explicitly official. The result is bounded to the declared universe and does not assert universal ranking causality."
    },
    {
      "block_id": "B",
      "confidence": "ND",
      "evidence_ids": [],
      "factor_id": "B07",
      "formulation": "Географическое покрытие",
      "priority": null,
      "rating_explanation": "Synthetic contract fixture: factor is marked not applicable.",
      "recommendation": null,
      "status": "NA",
      "why_important": "Географическое покрытие evaluates Страны в scope и распределение найденной видимости по странам. The mechanism is supported as platform_definition; the traffic-light cutoffs are classified as internal_audit_policy and are an audit decision unless explicitly official. The result is bounded to the declared universe and does not assert universal ranking causality."
    },
    {
      "block_id": "B",
      "confidence": "ND",
      "evidence_ids": [],
      "factor_id": "B08",
      "formulation": "Инвентарь обнаруженных промптов",
      "priority": null,
      "rating_explanation": "Synthetic contract fixture: factor is marked not applicable.",
      "recommendation": null,
      "status": "NA",
      "why_important": "Инвентарь обнаруженных промптов evaluates Формулировки prompt, model, country и связанные с ними сгенерированные ответы. The mechanism is supported as platform_definition; the traffic-light cutoffs are classified as internal_audit_policy and are an audit decision unless explicitly official. The result is bounded to the declared universe and does not assert universal ranking causality."
    },
    {
      "block_id": "B",
      "confidence": "ND",
      "evidence_ids": [],
      "factor_id": "B09",
      "formulation": "Текст AI-ответов",
      "priority": null,
      "rating_explanation": "Synthetic contract fixture: factor is marked not applicable.",
      "recommendation": null,
      "status": "NA",
      "why_important": "Текст AI-ответов evaluates Содержание generated answer/message по каждому возвращённому prompt record. The mechanism is supported as platform_definition; the traffic-light cutoffs are classified as internal_audit_policy and are an audit decision unless explicitly official. The result is bounded to the declared universe and does not assert universal ranking causality."
    },
    {
      "block_id": "B",
      "confidence": "ND",
      "evidence_ids": [],
      "factor_id": "B10",
      "formulation": "Контекст упоминания бренда",
      "priority": null,
      "rating_explanation": "Synthetic contract fixture: factor is marked not applicable.",
      "recommendation": null,
      "status": "NA",
      "why_important": "Контекст упоминания бренда evaluates За что, для кого и в каком утверждении бренд упоминается в доступном ответе. The mechanism is supported as platform_definition; the traffic-light cutoffs are classified as internal_audit_policy and are an audit decision unless explicitly official. The result is bounded to the declared universe and does not assert universal ranking causality."
    },
    {
      "block_id": "B",
      "confidence": "ND",
      "evidence_ids": [],
      "factor_id": "B11",
      "formulation": "Ландшафт цитируемых источников",
      "priority": null,
      "rating_explanation": "Synthetic contract fixture: factor is marked not applicable.",
      "recommendation": null,
      "status": "NA",
      "why_important": "Ландшафт цитируемых источников evaluates Hosts, domains, URLs, их `amount` и `prompt_count`, включая собственные и внешние источники. The mechanism is supported as platform_definition; the traffic-light cutoffs are classified as internal_audit_policy and are an audit decision unless explicitly official. The result is bounded to the declared universe and does not assert universal ranking causality."
    },
    {
      "block_id": "B",
      "confidence": "ND",
      "evidence_ids": [],
      "factor_id": "B12",
      "formulation": "Набор AI-конкурентов",
      "priority": null,
      "rating_explanation": "Synthetic contract fixture: factor is marked not applicable.",
      "recommendation": null,
      "status": "NA",
      "why_important": "Набор AI-конкурентов evaluates Бренды, которые SISTRIX относит к конкурентам в выбранном AI environment. The mechanism is supported as platform_definition; the traffic-light cutoffs are classified as no_normative_cutoff and are an audit decision unless explicitly official. The result is bounded to the declared universe and does not assert universal ranking causality."
    },
    {
      "block_id": "B",
      "confidence": "ND",
      "evidence_ids": [],
      "factor_id": "B13",
      "formulation": "Конкурентный контекст",
      "priority": null,
      "rating_explanation": "Synthetic contract fixture: factor is marked not applicable.",
      "recommendation": null,
      "status": "NA",
      "why_important": "Конкурентный контекст evaluates В каких формулировках, категориях и сравнениях появляются бренд и конкуренты. The mechanism is supported as platform_definition; the traffic-light cutoffs are classified as internal_audit_policy and are an audit decision unless explicitly official. The result is bounded to the declared universe and does not assert universal ranking causality."
    },
    {
      "block_id": "B",
      "confidence": "ND",
      "evidence_ids": [],
      "factor_id": "B14",